{
  "schema_version": "fabric/1.0",
  "event_id": "evt_019efb8f-2443-7ebe-aa74-7f1696771d03",
  "event_type": "relation.created",
  "occurred_at": "2026-06-24T18:35:22.691761-03:00",
  "actor": {
    "kind": "human",
    "id": "codex_protocol_spec_20260624"
  },
  "trust": {
    "level": "human_confirmed",
    "basis": "human"
  },
  "payload": {
    "relation": {
      "relation_id": "rel_019efb8f-2439-73b1-818e-0a3f73073c39",
      "type": "derived_from",
      "from": {
        "kind": "record",
        "id": "rec_019efb8f-2439-74e3-8bc7-e4c040d039ab"
      },
      "to": {
        "kind": "thread",
        "id": "codex_protocol_spec_20260624"
      },
      "created_at": "2026-06-24T18:35:22.681912-03:00"
    }
  }
}
