{
  "schema_version": "fabric/1.0",
  "event_id": "evt_019efb8f-239e-719c-acc5-292a500ff5c5",
  "event_type": "relation.created",
  "occurred_at": "2026-06-24T18:35:22.526493-03:00",
  "actor": {
    "kind": "human",
    "id": "thread_20260624_1538"
  },
  "trust": {
    "level": "human_confirmed",
    "basis": "human"
  },
  "payload": {
    "relation": {
      "relation_id": "rel_019efb8f-2393-7a05-8b62-89efd0831191",
      "type": "derived_from",
      "from": {
        "kind": "record",
        "id": "rec_019efb8f-2393-7b5a-8be1-1a9d4e9cf6eb"
      },
      "to": {
        "kind": "thread",
        "id": "thread_20260624_1538"
      },
      "created_at": "2026-06-24T18:35:22.515304-03:00"
    }
  }
}
