{
  "schema_version": "fabric/1.0",
  "event_id": "evt_019efb8f-23b2-7cf3-8486-39e298e85e6d",
  "event_type": "relation.created",
  "occurred_at": "2026-06-24T18:35:22.546479-03:00",
  "actor": {
    "kind": "human",
    "id": "thread_20260624_1623"
  },
  "trust": {
    "level": "human_confirmed",
    "basis": "human"
  },
  "payload": {
    "relation": {
      "relation_id": "rel_019efb8f-23a8-79f9-81c5-af1edf358274",
      "type": "derived_from",
      "from": {
        "kind": "record",
        "id": "rec_019efb8f-23a8-7cf4-a5f4-8400261d7fb7"
      },
      "to": {
        "kind": "thread",
        "id": "thread_20260624_1623"
      },
      "created_at": "2026-06-24T18:35:22.536451-03:00"
    }
  }
}
