{
  "schema_version": "fabric/1.0",
  "event_id": "evt_0197f552-0abd-7def-8123-123456789abc",
  "event_type": "relation.created",
  "occurred_at": "2026-06-24T18:01:00Z",
  "actor": {"kind": "agent", "id": "adapter-1", "provider": "codex"},
  "trust": {"level": "agent_asserted", "basis": "adapter report"},
  "payload": {
    "relation": {
      "relation_id": "rel_0197f552-0abd-7def-8123-123456789abc",
      "type": "informed_by",
      "from": {"kind": "action", "provider": "codex", "id": "opaque-action-1"},
      "to": {"kind": "record", "id": "rec_0197f552-0abc-7def-8123-123456789abc"},
      "created_at": "2026-06-24T18:01:00Z"
    }
  },
  "extensions": {
    "example.dev/adapter": {"opaque": true}
  }
}
