{
  "schema_version": "fabric/1.0",
  "event_id": "evt_019efb8f-2404-7918-9839-e4984715f3e1",
  "event_type": "record.created",
  "occurred_at": "2026-06-24T18:35:22.628695-03:00",
  "actor": {
    "kind": "human"
  },
  "trust": {
    "level": "human_confirmed",
    "basis": "human"
  },
  "payload": {
    "record": {
      "record_id": "rec_019efb8f-2404-706c-bfbb-e82b7af5eb64",
      "kind": "note",
      "created_at": "2026-06-24T17:55:11-03:00",
      "scope": {
        "repo": "fabric",
        "issue": "FAB-5",
        "areas": [
          "product-vision",
          "agent-protocol"
        ]
      },
      "source": {
        "type": "human"
      },
      "text": "Fabric is an agent-first repository decision and provenance protocol. Its CLI is a protocol client for coordinating multiple threads and worktrees, propagating findings and decisions with evidence and rationale, preventing repeated mistakes, and eventually letting users trace why an agent chose a path back to prior threads, PRs, and human direction. Provider integrations should adapt Codex, Claude, Cursor, and future agents to this shared protocol rather than make Fabric a provider-specific GitHub or LLM wrapper.",
      "confidence": "human_confirmed",
      "ttl": "until_issue_closed",
      "status": "active",
      "durability": "durable"
    }
  }
}
