{
  "schema_version": "fabric/1.0",
  "event_id": "evt_019efb8f-2439-7ec9-9306-5cdd82e16b23",
  "event_type": "record.created",
  "occurred_at": "2026-06-24T18:35:22.681911-03:00",
  "actor": {
    "kind": "human",
    "id": "codex_protocol_spec_20260624"
  },
  "trust": {
    "level": "human_confirmed",
    "basis": "human"
  },
  "payload": {
    "record": {
      "record_id": "rec_019efb8f-2439-74e3-8bc7-e4c040d039ab",
      "kind": "note",
      "created_at": "2026-06-24T18:12:51-03:00",
      "scope": {
        "repo": "fabric",
        "areas": [
          "product-vision",
          "remote-transport"
        ]
      },
      "source": {
        "type": "human",
        "thread_id": "codex_protocol_spec_20260624"
      },
      "text": "A future optional Fabric service will be a privately deployable end-to-end encrypted relay for account, repository, thread, receipt, and opaque protocol-event identifiers. It must never receive source code or plaintext Fabric payloads, and local Git-backed Fabric must remain fully usable without the service.",
      "confidence": "human_confirmed",
      "ttl": "until_issue_closed",
      "status": "active",
      "durability": "durable"
    }
  }
}
