{
  "schema_version": "fabric/1.0",
  "event_id": "evt_019efb8f-23da-77d8-be06-faccc7a222b6",
  "event_type": "relation.created",
  "occurred_at": "2026-06-24T18:35:22.586541-03:00",
  "actor": {
    "kind": "human",
    "id": "thread_20260624_1652"
  },
  "trust": {
    "level": "human_confirmed",
    "basis": "human"
  },
  "payload": {
    "relation": {
      "relation_id": "rel_019efb8f-23d0-7e88-b0b3-585354ba5bd9",
      "type": "derived_from",
      "from": {
        "kind": "record",
        "id": "rec_019efb8f-23d0-7136-9ea7-205adc17e847"
      },
      "to": {
        "kind": "thread",
        "id": "thread_20260624_1652"
      },
      "created_at": "2026-06-24T18:35:22.576571-03:00"
    }
  }
}
